{
  "schema_version": "1.0",
  "image_id": "test_0038.jpg",
  "pallet_id": "pallet-001",
  "pose": {
    "x_m": 0.0023258447647095948,
    "y_m": 0.9274446010589601,
    "theta_deg": 22.702842913683583,
    "sigma_x_m": 0.004564354645876399,
    "sigma_y_m": 0.004564354645876378,
    "sigma_theta_deg": 0.49425262377845974,
    "confidence": 0.672976553440094,
    "reliable": true,
    "reason": ""
  },
  "checks": [
    {
      "sop_id": 1,
      "name": "box overhang",
      "verdict": "manual_inspection",
      "confidence": 0.672976553440094,
      "measured": {},
      "reason": "insufficient reliable evidence"
    },
    {
      "sop_id": 2,
      "name": "load height",
      "verdict": "manual_inspection",
      "confidence": 0.672976553440094,
      "measured": {},
      "reason": "insufficient reliable evidence"
    },
    {
      "sop_id": 3,
      "name": "column alignment",
      "verdict": "manual_inspection",
      "confidence": 0.672976553440094,
      "measured": {},
      "reason": "insufficient reliable evidence"
    },
    {
      "sop_id": 4,
      "name": "size ordering",
      "verdict": "manual_inspection",
      "confidence": 0.2691906213760376,
      "measured": {
        "visible_inversion_score": 0.0
      },
      "reason": "rear and occluded boxes cannot be verified from one view"
    },
    {
      "sop_id": 5,
      "name": "stretch wrap",
      "verdict": "manual_inspection",
      "confidence": 0.672976553440094,
      "measured": {},
      "reason": "insufficient reliable evidence"
    },
    {
      "sop_id": 6,
      "name": "visible box damage",
      "verdict": "manual_inspection",
      "confidence": 0.0,
      "measured": {
        "damage_probability": 0
      },
      "reason": "only visible faces are assessable"
    },
    {
      "sop_id": 7,
      "name": "load centring",
      "verdict": "manual_inspection",
      "confidence": 0.672976553440094,
      "measured": {},
      "reason": "insufficient reliable evidence"
    },
    {
      "sop_id": 8,
      "name": "pallet damage",
      "verdict": "manual_inspection",
      "confidence": 0.0,
      "measured": {
        "damage_probability": 0
      },
      "reason": "hidden boards and rear stringers are not visible"
    }
  ],
  "overall_verdict": "manual_inspection",
  "reasons": [
    "SOP-1 needs inspection: box overhang",
    "SOP-2 needs inspection: load height",
    "SOP-3 needs inspection: column alignment",
    "SOP-4 needs inspection: size ordering",
    "SOP-5 needs inspection: stretch wrap",
    "SOP-6 needs inspection: visible box damage",
    "SOP-7 needs inspection: load centring",
    "SOP-8 needs inspection: pallet damage"
  ],
  "provenance": {
    "model_version": "pose-yolo11n+seg-yolo11n-synthetic-v1",
    "assessed_at": "2026-08-22T15:45:59.280116+00:00",
    "pose_sha256": "8c431fe1dc0891cf818577da3bf67de91a5421bea76e7f298d431661676c3cdd",
    "segment_sha256": "94a850c4fef973b2d59dc5def8a3fafb049918625557035fc41b7763651a7b97",
    "image_sha256": "a2692e0781dd83fa1a6eea98d69f655671f3b4f0eec5c28b23d86e6289f210fc",
    "device": "cpu",
    "imgsz": 256,
    "latency_ms": {
      "pose": 84.80160002363846,
      "segment": 86.7436999687925
    },
    "associated_detections": [
      {
        "class": "box",
        "confidence": 0.9847989678382874
      },
      {
        "class": "box",
        "confidence": 0.9616187214851379
      },
      {
        "class": "box",
        "confidence": 0.935024082660675
      },
      {
        "class": "box",
        "confidence": 0.8916260004043579
      },
      {
        "class": "box",
        "confidence": 0.8841323256492615
      },
      {
        "class": "pallet",
        "confidence": 0.8834934830665588
      },
      {
        "class": "box",
        "confidence": 0.8755802512168884
      },
      {
        "class": "stretch_wrap",
        "confidence": 0.423193097114563
      },
      {
        "class": "box",
        "confidence": 0.3508863151073456
      },
      {
        "class": "box",
        "confidence": 0.15800733864307404
      }
    ],
    "experimental_evidence": {
      "box_angles_deg": [
        14.159931282482148,
        7.50029738388946,
        42.13215569213651,
        15.79596611532611,
        36.04687404681647,
        9.110764995176737
      ],
      "would_fail_sop3": true
    },
    "validation_gates": {
      "box_alignment": "disabled: raw evidence falsely failed 46/60 aligned synthetic scenes",
      "wrap_presence": "enabled only for positive detections: box mAP50-95=0.833",
      "load_footprint": "disabled: load mask mAP50-95=0.006",
      "visible_box_damage": "disabled: held-out AP=0",
      "visible_pallet_damage": "disabled: held-out AP=0"
    },
    "claim_scope": "synthetic-v1 demonstration; not warehouse validated"
  }
}
